;Tidligste såning/plantning;Seneste såning/plantning;Plantes eller sås direkte I jorden;Sædskifteinterval;Antal frø eller planter per meter række;Sådybde;Anbefalet afstand mellem rækkerne I cm;Gødningsniveau;Forventet høst per række
Persille plantet ud som småplante;1. april;15. juli;plantes;4 år;4;;35;mellem;20 bundter
Dild;15. marts;1. august;såning;2 år;50;2 cm;25;mellem;20 bundter
Koriander;15. marts;1. september;såning;2 år;50;2 cm;25;mellem;10 bundter
Basilikum (plantet ud som småplante);15. maj;15. juli;plantes;1 år;50;plantes ikke for dybt;35;mellem;10 bundter
Timian;15. april;15. juli;plantes;stauder som står på samme sted mange år frem;4;;35;mellem;25 bundter
Mynte;15. april;15. juli;plantes;stauder som står på samme sted mange år frem;4;;35;mellem;25 bundter
Oregano;15. april;15. juli;plantes;stauder som står på samme sted mange år frem;4;;35;mellem;25 bundter
